{
  "$schema": "../schemas/service-registry.schema.json",
  "version": 1,
  "supportedCalculatorServiceCodes": ["ECS", "Flexus L", "EVS", "OBS", "ELB", "EIP", "NAT", "VPN", "CCE", "CCI", "ModelArts"],
  "supportedBatchAddServiceCodes": ["ECS", "Flexus L", "EVS", "OBS", "CCE", "CCI"],
  "definitions": [
    {
      "serviceCode": "OBS",
      "definitionId": "obs",
      "serviceDefinitionPath": "./obs/service.json",
      "pricingDefinitionPath": "./obs/pricing.json",
      "status": "active"
    },
    {
      "serviceCode": "EVS",
      "definitionId": "evs",
      "serviceDefinitionPath": "./evs/service.json",
      "pricingDefinitionPath": "./evs/pricing.json",
      "status": "pilot"
    },
    {
      "serviceCode": "EIP",
      "definitionId": "eip",
      "serviceDefinitionPath": "./eip/service.json",
      "pricingDefinitionPath": "./eip/pricing.json",
      "status": "active"
    },
    {
      "serviceCode": "NAT",
      "definitionId": "nat",
      "serviceDefinitionPath": "./nat/service.json",
      "pricingDefinitionPath": "./nat/pricing.json",
      "status": "active"
    },
    {
      "serviceCode": "VPN",
      "definitionId": "vpn",
      "serviceDefinitionPath": "./vpn/service.json",
      "pricingDefinitionPath": "./vpn/pricing.json",
      "status": "active"
    },
    {
      "serviceCode": "CCE",
      "definitionId": "cce",
      "serviceDefinitionPath": "./cce/service.json",
      "pricingDefinitionPath": "./cce/pricing.json",
      "status": "active"
    },
    {
      "serviceCode": "CCI",
      "definitionId": "cci",
      "serviceDefinitionPath": "./cci/service.json",
      "pricingDefinitionPath": "./cci/pricing.json",
      "status": "active"
    },
    {
      "serviceCode": "ModelArts",
      "definitionId": "modelarts",
      "serviceDefinitionPath": "./modelarts/service.json",
      "pricingDefinitionPath": "./modelarts/pricing.json",
      "status": "active"
    }
  ],
  "services": [
    { "name": "Bare Metal Server", "code": "BMS", "icon": "https://res-static.hc-cdn.cn/cloudbu-site/public/product-banner-icon/Compute/BMS.png" },
    { "name": "Auto Scaling", "code": "AS", "icon": "https://res-static.hc-cdn.cn/cloudbu-site/public/product-banner-icon/Compute/AS.png" },
    { "name": "SoftWare Repository for Container", "code": "SWR", "icon": "https://res-static.hc-cdn.cn/cloudbu-site/public/product-banner-icon/Containers/SWR.png" },
    { "name": "Cloud Container Instance", "code": "CCI", "icon": "https://res-static.hc-cdn.cn/cloudbu-site/public/product-banner-icon/Containers/CCI.png" },
    { "name": "Cloud Container Instance 2.0", "code": "CCI 2.0", "icon": "https://res-static.hc-cdn.cn/cloudbu-site/public/product-banner-icon/Containers/CCI.png" },
    { "name": "Flexus CCI", "code": "Flexus CCI", "icon": "https://res-static.hc-cdn.cn/cloudbu-site/public/product-banner-icon/Containers/CCI.png" },
    { "name": "Dedicated Host", "code": "DeH", "icon": "https://res-static.hc-cdn.cn/cloudbu-site/public/product-banner-icon/Compute/DeH.png" },
    { "name": "Cloud Container Engine", "code": "CCE", "icon": "https://res-static.hc-cdn.cn/cloudbu-site/public/product-banner-icon/Containers/CCE.png" },
    { "name": "Elastic Cloud Server", "code": "ECS", "icon": "https://res-static.hc-cdn.cn/cloudbu-site/public/product-banner-icon/Compute/ECS.png" },
    { "name": "Flexus L Instance", "code": "Flexus L", "icon": "https://res-static.hc-cdn.cn/aem/program/prod/common/china/zh-cn/service-icon/hcss.svg" },
    { "name": "Flexus X Instance", "code": "Flexus X", "icon": "https://res-static.hc-cdn.cn/cloudbu-site/public/product-banner-icon/Compute/FECSX.png" },
    { "name": "MapReduce Service", "code": "MRS", "icon": "https://res-static.hc-cdn.cn/cloudbu-site/public/product-banner-icon/Analytics/DWS.png" },
    { "name": "DataArts Insight", "code": "DataArts Insight", "icon": "https://res-static.hc-cdn.cn/cloudbu-site/public/product-banner-icon/Analytics/DataArts.png" },
    { "name": "Data Ingestion Service", "code": "DIS", "icon": "https://res-static.hc-cdn.cn/cloudbu-site/public/product-banner-icon/Analytics/DIS.png" },
    { "name": "DataArts Studio(DGC)", "code": "DGC", "icon": "https://res-static.hc-cdn.cn/cloudbu-site/public/product-banner-icon/Analytics/DataArts.png" },
    { "name": "Data Lake Insight", "code": "DLI", "icon": "https://res-static.hc-cdn.cn/cloudbu-site/public/product-banner-icon/Analytics/DLI.png" },
    { "name": "DataArts Lake Formation", "code": "Lake Formation", "icon": "https://res-static.hc-cdn.cn/cloudbu-site/public/product-banner-icon/Analytics/DataArts.png" },
    { "name": "Data Warehouse Service", "code": "DWS", "icon": "https://res-static.hc-cdn.cn/cloudbu-site/public/product-banner-icon/Analytics/DWS.png" },
    { "name": "Cloud Search Service", "code": "CSS", "icon": "https://res-static.hc-cdn.cn/cloudbu-site/public/product-banner-icon/Analytics/CSS.png" },
    { "name": "Distributed Cache Service (for Redis)", "code": "DCS", "icon": "https://res-static.hc-cdn.cn/cloudbu-site/public/product-banner-icon/Middleware/Memcached.png" },
    { "name": "Distributed Database Middleware", "code": "DDM", "icon": "https://res-static.hc-cdn.cn/cloudbu-site/public/product-banner-icon/Databases/DDM.png" },
    { "name": "Data Replication Service", "code": "DRS", "icon": "https://res-static.hc-cdn.cn/cloudbu-site/public/product-banner-icon/Databases/DRS.png" },
    { "name": "UGO", "code": "UGO", "icon": "https://res-static.hc-cdn.cn/cloudbu-site/public/product-banner-icon/Databases/UGO.png" },
    { "name": "Graph Engine Service", "code": "GES", "icon": "https://res-static.hc-cdn.cn/cloudbu-site/public/product-banner-icon/AI/ges.png" },
    { "name": "Document Database Service", "code": "DDS", "icon": "https://res-static.hc-cdn.cn/cloudbu-site/public/product-banner-icon/Databases/DDS.png" },
    { "name": "GeminiDB", "code": "GeminiDB", "icon": "https://res-static.hc-cdn.cn/cloudbu-site/public/product-banner-icon/Databases/GaussDBfornosql.png" },
    { "name": "Relational Database Service", "code": "RDS", "icon": "https://res-static.hc-cdn.cn/cloudbu-site/public/product-banner-icon/Databases/RDSforMySQL.png" },
    { "name": "GaussDB", "code": "GaussDB", "icon": "https://res-static.hc-cdn.cn/cloudbu-site/public/product-banner-icon/Databases/GaussDB.png" },
    { "name": "TaurusDB", "code": "TaurusDB", "icon": "https://res-static.hc-cdn.cn/cloudbu-site/public/product-banner-icon/Databases/GaussDBforMySQL.png" },
    { "name": "Flexus RDS", "code": "Flexus RDS", "icon": "https://res-static.hc-cdn.cn/cloudbu-site/public/product-banner-icon/Compute/FRDS.png" },
    { "name": "IoT Device Management", "code": "IoTDM", "icon": "https://res-static.hc-cdn.cn/cloudbu-site/public/product-banner-icon/InternetofThings/IoTDM.png" },
    { "name": "IoTDA", "code": "IoTDA", "icon": "https://res-static.hc-cdn.cn/cloudbu-site/public/product-banner-icon/InternetofThings/IoTDA.png" },
    { "name": "ModelArts", "code": "ModelArts", "icon": "https://res-static.hc-cdn.cn/cloudbu-site/public/product-banner-icon/AI/ModelArts.png" },
    { "name": "ModelArts Studio", "code": "ModelArts Studio", "icon": "https://res-static.hc-cdn.cn/cloudbu-site/public/product-banner-icon/AI/ModelArts.png" },
    { "name": "API Gateway", "code": "APIG", "icon": "https://res-static.hc-cdn.cn/cloudbu-site/public/product-banner-icon/Middleware/APIG.png" },
    { "name": "ServiceStage", "code": "ServiceStage", "icon": "https://res-static.hc-cdn.cn/cloudbu-site/public/product-banner-icon/DeveloperServices/ServiceStage.png" },
    { "name": "CodeArts Artifact", "code": "CodeArts Artifact", "icon": "https://res-static.hc-cdn.cn/cloudbu-site/public/product-banner-icon/DeveloperServices/CodeArtsArtifact.png" },
    { "name": "CodeArts Build", "code": "CodeArts Build", "icon": "https://res-static.hc-cdn.cn/cloudbu-site/public/product-banner-icon/DeveloperServices/CodeArtsBuild.png" },
    { "name": "CodeArts Pipeline", "code": "CodeArts Pipeline", "icon": "https://res-static.hc-cdn.cn/cloudbu-site/public/product-banner-icon/DeveloperServices/CodeArtsPipeline.png" },
    { "name": "CodeArts Check", "code": "CodeArts Check", "icon": "https://res-static.hc-cdn.cn/cloudbu-site/public/product-banner-icon/DeveloperServices/CodeArtsCheck.png" },
    { "name": "CodeArts", "code": "CodeArts", "icon": "https://res-static.hc-cdn.cn/cloudbu-site/public/product-banner-icon/DeveloperServices/CodeArts.png" },
    { "name": "EventGrid", "code": "EventGrid", "icon": "https://res-static.hc-cdn.cn/cloudbu-site/public/product-banner-icon/BusinessApplications/ROMAConnect.png" },
    { "name": "Elastic Load Balance", "code": "ELB", "icon": "https://res-static.hc-cdn.cn/cloudbu-site/public/product-banner-icon/Networking/ELB.png" },
    { "name": "CodeArts TestPlan", "code": "CodeArts TestPlan", "icon": "https://res-static.hc-cdn.cn/cloudbu-site/public/product-banner-icon/DeveloperServices/CodeArtsTestPlan.png" },
    { "name": "Image Management Service", "code": "IMS", "icon": "https://res-static.hc-cdn.cn/cloudbu-site/public/product-banner-icon/Compute/IMS.png" },
    { "name": "Log Tank Service", "code": "LTS", "icon": "https://res-static.hc-cdn.cn/cloudbu-site/public/product-banner-icon/ManagementGovernance/LTS.png" },
    { "name": "Simple Message Notification", "code": "SMN", "icon": "https://res-static.hc-cdn.cn/cloudbu-site/public/product-banner-icon/ManagementGovernance/SMN.png" },
    { "name": "Application Operations Management", "code": "AOM", "icon": "https://res-static.hc-cdn.cn/cloudbu-site/public/product-banner-icon/ManagementGovernance/AOM.png" },
    { "name": "Application Performance Management", "code": "APM", "icon": "https://res-static.hc-cdn.cn/cloudbu-site/public/product-banner-icon/ManagementGovernance/APM.png" },
    { "name": "Cloud Eye", "code": "CES", "icon": "https://res-static.hc-cdn.cn/cloudbu-site/public/product-banner-icon/ManagementGovernance/CES.png" },